tmdb_id,imdb_id,title,release_date,runtime,genres,budget,revenue,tmdb_rating,tmdb_vote_count,production_companies,original_language,overview,cast,crew,imdb_rating,imdb_votes,metascore,source,release_year,profit
7451,tt0295701,xXx,2002-08-09,124,"Action, Adventure, Thriller, Crime, Drama",70000000.0,277448382.0,5.986,4866,Revolution Studios,en,"Xander Cage is your standard adrenaline junkie with no fear and a lousy attitude. When the US Government ""recruits"" him to go on a mission, he's not exactly thrilled. His mission: to gather information on an organization that may just be planning the destruction of the world, led by the nihilistic Yorgi.","Vin Diesel, Asia Argento, Marton Csokas, Samuel L. Jackson, Michael Roof","Rob Cohen, Rich Wilkes, Neal H. Moritz",5.9,192071.0,48.0,omdb,2002,207448382.0
1115544,tt27552099,Mike & Nick & Nick & Alice,2026-03-14,107,"Comedy, Science Fiction, Crime",,,6.769,270,"20th Century Studios, Mad Chance",en,"Two gangsters and the woman they love try to survive the most dangerous night of their lives. As if that wasn’t enough, there’s one wild ingredient added to the mix: a time machine.","James Marsden, Vince Vaughn, Eiza González, Keith David, Jimmy Tatro","Andrew Lazar, BenDavid Grabinski",6.2,15353.0,70.0,omdb,2026,
1499885,tt36332085,The Red Book Ritual: Gates of Hell,2025-09-18,0,Horror,,,2.8,6,"Black Mandala, Nightwheel Pictures",en,"Robbie embarks on a dangerous quest to contact his deceased girlfriend through a ritual that summons the dead. He heads to an abandoned house with a group of young people to perform the ""Red Book Ritual."" But during the summoning, supernatural forces awaken. Now they must face ancient horrors to survive.","Mario González Martí, Lizzie Gómez, Matias Miranda, Tainá Lipinski, Bianca Vacchetta","Carlos Baena, Hugo Cardozo, Nathan Crooker, Sonny Laguna, Hernán Moyano",,,,omdb,2025,
1659087,tt40891145,180,2026-04-16,94,"Thriller, Crime, Drama",,,5.677,62,Ten30 Pictures,en,"When an unexpected road rage incident puts his son in critical condition, an enraged father spirals down a dark path of emotional turmoil and vengeance.","Prince Grootboom, Noxolo Dlamini, Danica De La Rey, Warren Masemola, Desmond Dube",Alex Yazbek,4.6,153.0,,omdb,2026,
680493,tt22868010,Return to Silent Hill,2026-01-21,106,"Mystery, Drama, Horror",23000000.0,47372551.0,5.277,419,"Konami, Davis Films, Ashland Hill Media Finance, Supernix, WIP, Richmond Pictures, Lipsync Productions, Electric Shadow Company",en,"When James receives a mysterious letter from his lost love Mary, he is drawn to Silent Hill—a once-familiar town now consumed by darkness. As he searches for her, James faces monstrous creatures and unravels a terrifying truth that will push him to the edge of his sanity.","Jeremy Irvine, Hannah Emily Anderson, Evie Templeton, Pearse Egan, Nicola Alexis","Victor Hadida, Molly Hassell, David M. Wulf, John Jencks, Jay Taylor",4.0,17409.0,34.0,omdb,2026,24372551.0
634649,tt10872600,Spider-Man: No Way Home,2021-12-15,148,"Action, Adventure, Science Fiction",200000000.0,1921847111.0,7.933,21840,"Marvel Studios, Pascal Pictures, Columbia Pictures",en,"Peter Parker is unmasked and no longer able to separate his normal life from the high-stakes of being a super-hero. When he asks for help from Doctor Strange the stakes become even more dangerous, forcing him to discover what it truly means to be Spider-Man.","Tom Holland, Zendaya, Benedict Cumberbatch, Jacob Batalon, Jon Favreau","Kevin Feige, Amy Pascal, Jon Watts",8.1,1016161.0,71.0,omdb,2021,1721847111.0
1418657,tt14500286,The Yeti,2026-04-04,93,"Horror, Thriller",,,6.671,38,"Torfoot Films, Hardscrabble Film Company",en,"When an oil tycoon and a famous adventurer vanish into the harsh winter of remote northern Alaska, a hand-picked rescue team endeavors to bring them home. What they don’t know is that they are trespassing on The Yeti’s territory, and the elements are the least of their worries.","Brittany Allen, Eric Nelsen, Corbin Bernsen, William Sadler, Heather Lind","Gene Gallerano, William Pisciotta, Johnathan Brownlee, Gene Gallerano, Ross Meyerson",3.8,612.0,,omdb,2026,
1367642,tt33714084,Reminders of Him,2026-03-11,114,"Romance, Drama",30000000.0,87078896.0,7.266,156,"Universal Pictures, Heartbones Entertainment, Little Engine Productions",en,"When Diem's custodial grandparents adamantly refuse Kenna's attempts to see her daughter, Kenna discovers unexpected compassion, and then something truer and deeper, with former NFL player and local bar owner Ledger. As their secret romance develops, so do the dangers for both of them, leading Kenna toward heartbreak and, ultimately, the hope for a second chance.","Maika Monroe, Tyriq Withers, Rudy Pankow, Bradley Whitford, Lauren Graham","Lauren Levine, Colleen Hoover, Lauren Levine, Colleen Hoover, Vanessa Caswill",6.3,5740.0,49.0,omdb,2026,57078896.0
1511057,tt37540875,Roommates,2026-04-13,108,Comedy,,,6.428,69,Happy Madison Productions,en,"When shy college freshman Devon asks cool-girl Celeste to be her roommate, a blossoming friendship quickly spirals into a war of passive aggression.","Sadie Sandler, Chloe East, Billy Bryk, Sarah Sherman, Martin Herlihy","Chandler Levack, Adam Sandler, Tim Herlihy",5.7,2181.0,57.0,omdb,2026,
